{
  "channels": ["file-bridge", "agent-tunnel", "control"],
  "platforms": ["server", "agent", "agentd"],
  "dataDomains": ["local", "owned"],
  "states": ["bound", "offline", "revoked"],
  "protocolImpact": ["additive"],
  "dataImpact": ["none"],
  "requiredEvidence": ["L0", "L1", "L2", "L3", "L4"],
  "failureInjections": [
    "agent-local-readonly-blocks-write-despite-primary-allow",
    "primary-acl-deny-blocks-despite-agent-allow",
    "path-dotdot-escapes-share-root",
    "absolute-path-rejected",
    "symlink-escape-rejected",
    "non-loopback-listen-requires-approval",
    "stale-policy-generation-rejects-lease",
    "unnegotiated-v2-frame-rejected"
  ],
  "compatibility": ["old-server", "old-client", "new-server", "new-client"],
  "rollback": [
    "git revert the P5 commit on zephyr-link-foundation-v1",
    "file-agent-manager without policyContext keeps previous readOnly share check",
    "path jail is additive fail-closed on relativePath"
  ],
  "evidenceLinks": [
    "docs/zephyr-link/TESTING-AND-RELEASE-GATES.md",
    "docs/zephyr-link/ZEPHYR-LINK-INTERCONNECTION-SPEC.md"
  ]
}
